Scene_ID,Character,Dialogue,Scene_Description,Metadata
0.0,Star Trek V,The Final Frontier,,
0.0,SYBOK,"I thought weapons were forbidden on this planet. ... Besides, I can't believe you'd kill me for a field of empty holes.",,"""The Planet of Galactic Peace"""
0.0,J'ONN,It's all I have.,,(out of a dust storm a horseman approaches an alien drilling for water. The horseman dismounts and addresses the alien)
0.0,SYBOK,Your pain runs deep.,,
0.0,J'ONN,What do you know of my pain?,,
0.0,SYBOK,Let us explore it ...together. ...Each man hides a secret pain. It must be exposed and reckoned with. It must be dragged from the darkness and forced into the light. Share your pain. ...Share your pain with me and gain strength from it.,,
0.0,J'ONN,Where did you get this power?,,
0.0,SYBOK,The power was within you.,,
0.0,J'ONN,It is as if a weight has been lifted from my heart. How can I repay you for this miracle?,,
0.0,SYBOK,Join my quest.,,
0.0,J'ONN,What is it you seek?,,
0.0,SYBOK,"What you seek. What all men have sought since time began, ...the ultimate knowledge. To find it, we'll need a starship.",,
0.0,J'ONN,A starship? There are no starships on Nimbus Three.,,
0.0,SYBOK,Perhaps I have a way to bring one here.,,
0.0,J'ONN,But how?,,
0.0,SYBOK,Have faith my friend. There are more of us than you know.,,
0.0,J'ONN,You're a Vulcan!,,
1.0,McCOY,"'You'll have a great time, Bones. You'll enjoy your shore leave. You'll be able to relax.' You call this relaxing? I'm a nervous wreck. ...If I'm not careful I'll end up talking to myself.",[Yosemite campsite],Stardate 8454.1
2.0,SPOCK,"Greetings, Captain.",[El Capitan],
2.0,KIRK,Spock! ...What are you doing in this neck of the woods?,[El Capitan],
2.0,SPOCK,I have been monitoring your progress.,[El Capitan],(Spock appears alongside Kirk on levitation boots)
2.0,KIRK,"I'm flattered. Twelve hundred points of interest in Yosemite, you pick me.",[El Capitan],
2.0,SPOCK,I regret to inform you that the record time for freeclimbing El Capitan is in no danger of being broken.,[El Capitan],
2.0,KIRK,I'm not trying to break any records. I'm doing this because I enjoy it. Not to mention the most important reason for climbing a mountain.,[El Capitan],
2.0,SPOCK,And that is?,[El Capitan],
2.0,KIRK,Because it's there.,[El Capitan],
2.0,SPOCK,"Captain, I do not think you realise the gravity of your situation.",[El Capitan],
2.0,KIRK,"On the contrary. Gravity is foremost on my mind. Look, I'm trying to make an ascent here. Why don't you go pester Doctor McCoy for a while?",[El Capitan],
2.0,SPOCK,I believe that Doctor McCoy is not in the best of moods.,[El Capitan],
3.0,McCOY,Goddamn irresponsible! ...Playing games with life.,[Yosemite campsite],
4.0,SPOCK,Concentration is vital. You must be one with the rock.,[El Capitan],
4.0,KIRK,"Spock, I appreciate your concern but if you don't stop distracting me, I'm liable to be one with the...",[El Capitan],
5.0,SPOCK,Perhaps 'because it is there' is not a sufficient reason for wanting for climbing a mountain.,[Yosemite campsite],
5.0,KIRK,I'm hardly in a position to disagree.,[Yosemite campsite],"(Kirk plunges Earthwards, Spock using his levitation boots heads after him catching him inches from the ground)"
5.0,KIRK,"Hi, Bones. Mind if we drop in for dinner?",[Yosemite campsite],
7.0,CAITHLIN,"Gentlemen, I'm Caithlin Dar.",[Paradise City saloon backroom],Paradise City
7.0,TALBOT,"Ah, yes. Our new Romulan representative. Welcome to Paradise City, my dear, capital of the socalled 'Planet of Galactic Peace.' I'm St. John Talbot, the Federation representative here on Nimbus Three and my charming companion, here, is the Klingon consul Korrd.",[Paradise City saloon backroom],Nimbus III
7.0,KORRD,Ugghhhh!,[Paradise City saloon backroom],
7.0,CAITHLIN,I expect that's Klingon for hello.,[Paradise City saloon backroom],
7.0,TALBOT (OC),"Won't you come in, my dear?",[Paradise City saloon backroom],
7.0,CAITHLIN,"Twenty years ago, our three governments agreed to develop this planet together. A new age was born.",[Paradise City saloon backroom],
7.0,TALBOT,"Our new age died a quick death. And the settlers we conned into coming here, they were the dregs of the galaxy. They immediately took to fighting amongst themselves. We forbad them weapons, but they soon began to fashion their own.",[Paradise City saloon backroom],
7.0,CAITHLIN,Right! Then it appears I've arrived just in time.,[Paradise City saloon backroom],(Sybok and his followers approach Paradise City)
8.0,J'ONN,Get away from that transmitter!,[Paradise City saloon backroom],
8.0,SYBOK,Romulan. ...Terran. ...Klingon. Consider yourselves my prisoners.,[Paradise City saloon backroom],(a klaxon sounds and the three of them rush outside as Sybok and his followers storm the city)
8.0,TALBOT,Prisoners? We're already prisoners here on this worthless lump of rock. What possible value could we be to you?,[Paradise City saloon backroom],
8.0,SYBOK,"Nimbus Three may be a worthless lump of rock, but it does have one unique treasure. It's the only place in the entire galaxy that has the three of you.",[Paradise City saloon backroom],
8.0,CAITHLIN,I don't know who you are or what you want but I can tell you this. Our governments will stop at nothing to ensure our safety.,[Paradise City saloon backroom],
8.0,SYBOK,That's exactly what I'm counting on.,[Paradise City saloon backroom],
9.0,SCOTT (OC),"U.S.S. Enterprise, shakedown cruise report. I think this new ship was put together by monkeys. Och, she's got a fine engine, but half the doors won't open, and guess whose job it is to make it right?",[Spacedock],
10.0,SCOTT,"Borgus frat! 'Let's see what she's got' said the Captain. And then we found out, didn't we?",[Enterprise-A bridge],
10.0,UHURA,"I know you'll whip her into shape, Scotty. You always do.",[Enterprise-A bridge],
10.0,SCOTT,"Uhura, I thought you were on leave?",[Enterprise-A bridge],
10.0,UHURA,And I thought we were supposed to be going together.,[Enterprise-A bridge],
10.0,SCOTT,Oh I can't leave her when she needs me the most.,[Enterprise-A bridge],
10.0,UHURA,I had a feeling you would say something like that. So I brought us ...dinner.,[Enterprise-A bridge],
10.0,SCOTT,"Oh lass, you're the most understanding woman I know.",[Enterprise-A bridge],
10.0,COMMAND VOICE,distorted RED ALERT. RED ALERT.,[Enterprise-A bridge],
10.0,SCOTT,"I just fixed that damn thing. Turn it off, will you?",[Enterprise-A bridge],
10.0,COMMAND VOICE,"RED ALERT. RED ALERT. This is a RED ALERT. Enterprise, acknowledge.",[Enterprise-A bridge],
10.0,UHURA,This is Enterprise. Identify yourself.,[Enterprise-A bridge],
10.0,COMMAND VOICE,"Enterprise, this is Starfleet. We have a Priority Seven situation in the Neutral Zone.",[Enterprise-A bridge],
10.0,UHURA,"Stand by, Starfleet. ...Scotty, this is for real.",[Enterprise-A bridge],
10.0,SCOTT,They can't be serious! The ship's in pieces and we've got less than a skeleton crew aboard.,[Enterprise-A bridge],
10.0,UHURA,"Starfleet, are you aware of our current status?",[Enterprise-A bridge],
10.0,COMMAND VOICE,Current status understood. Stand by to copy operational orders and recall key personnel.,[Enterprise-A bridge],
11.0,CHEKOV,Admit it. We're lost.,[Earth - forest],
11.0,SULU,"All right, we're lost. But we're making good time.",[Earth - forest],
11.0,UHURA (on communicator),"Commander Sulu, come in please.",[Earth - forest],
11.0,SULU,I don't believe this. Commander Sulu here.,[Earth - forest],
12.0,UHURA,"Bad news, gentlemen. Shore leave is cancelled.",[Enterprise-A bridge],
13.0,CHEKOV,Rescued at last.,[Earth - forest],
13.0,UHURA (on communicator),Return to the prearranged coordinates for pickup.,[Earth - forest],
13.0,CHEKOV,You can't tell them we're lost. We'd never live it down.,[Earth - forest],
14.0,UHURA,"Is there a problem, gentlemen?",[Enterprise-A bridge],
15.0,SULU,"Er, ...yes. Er... We've been caught in a blizzard!",[Earth - forest],
15.0,CHEKOV,"Shhhh, Shhhh, and we can't see a thing. Request you direct us to the coordinates.",[Earth - forest],
16.0,UHURA,My visual says ...sunny skies and seventy degrees.,[Enterprise-A bridge],
16.0,CHEKOV,Sulu! Look! The sun's come out! It's a miracle!,[Enterprise-A bridge],
16.0,UHURA (on intercom),"Don't worry, fellas. Your secret's safe with me. I'll send the shuttlecraft to pick you up.",[Enterprise-A bridge],
16.0,SULU,"Uhura, I owe you one.",[Enterprise-A bridge],
17.0,McCOY,Come and get it! Come and get it!,[Yosemite campsite],
17.0,KIRK,"Bones! Bones! Knock it off. We're right here, ...and we're starving.",[Yosemite campsite],
17.0,SPOCK,"Bipodal seeds, Doctor?",[Yosemite campsite],
17.0,McCOY,"Beans, Spock, but no ordinary beans. These are from an old Southern recipe handed down to me by my father. And if you stick your Vulcan nose up at these, you're not only insulting me, but generations of McCoys.",[Yosemite campsite],
17.0,SPOCK,"In that case, I have little choice but to sample your beans. ...Hm! Surprisingly good. It does have a flavouring I am not familiar with.",[Yosemite campsite],
17.0,McCOY,Ah! That's the secret ingredient.,[Yosemite campsite],
17.0,KIRK,"Got any more of that secret ingredient, Bones?",[Yosemite campsite],
17.0,McCOY,"Be my guest, Captain.",[Yosemite campsite],
17.0,KIRK,Thank you.,[Yosemite campsite],
17.0,SPOCK,Am I to understand that your secret ingredient is ...alcohol?,[Yosemite campsite],
17.0,McCOY,"Whiskey. Tennessee whiskey, Spock! . Care for a little snort?",[Yosemite campsite],
17.0,KIRK,Bourbon and beans. An explosive combination. Do you think Spock can handle it?,[Yosemite campsite],
17.0,McCOY,Are you kidding? With that Vulcan metabolism he could eat a bowl of termites and it wouldn't bother him.,[Yosemite campsite],
17.0,SPOCK,"As you are so fond of pointing out, Doctor, I am half human.",[Yosemite campsite],
17.0,McCOY,"Well, it certainly doesn't show.",[Yosemite campsite],
17.0,SPOCK,Thank you.,[Yosemite campsite],
17.0,McCOY,"How do you like it? This guy never changes. I insult him and he takes it as a compliment. ...Uh, you two of you could drive a man to drink.",[Yosemite campsite],
17.0,KIRK,Me? What did I do?,[Yosemite campsite],
17.0,McCOY,What did you do? You piss me off. Human life is far too precious to risk on crazy stunts. Maybe it didn't cross that macho mind of yours that you should have been killed when you fell off that mountain.,[Yosemite campsite],
17.0,KIRK,It crossed my mind.,[Yosemite campsite],
17.0,McCOY,And?,[Yosemite campsite],
17.0,KIRK,"And, as I fell, I knew I wouldn't die.",[Yosemite campsite],
17.0,McCOY,I thought he was the only one who's immortal.,[Yosemite campsite],
17.0,KIRK,"It isn't that, Bones. I knew I wouldn't die because the two of you were with me.",[Yosemite campsite],
17.0,SPOCK,I do not understand.,[Yosemite campsite],
17.0,KIRK,I've always known ...I'll die alone.,[Yosemite campsite],
17.0,McCOY,"Well, I'll call Valhalla and reserve you a room. It's a mystery what draws us together. All that time in space ...getting on each other's nerves ...and what do we do when shore leave comes along? We spend it together. Other people have families.",[Yosemite campsite],
17.0,KIRK,"Other people, Bones. Not us. ...What are you doing?",[Yosemite campsite],
17.0,SPOCK,I am preparing to toast a 'marsh melon'.,[Yosemite campsite],
17.0,McCOY,"Well, I'll be damned. A marsh melon. Where did you learn to do that?",[Yosemite campsite],
17.0,SPOCK,Before leaving the ship I consulted the computer library to familiarise myself with the customs associated with 'camping out.',[Yosemite campsite],
17.0,McCOY,"Tell me, Spock. What do we do after we toast the marsh, ...er, melons?",[Yosemite campsite],
17.0,SPOCK,We consume them.,[Yosemite campsite],
17.0,McCOY,I know we consume them. I mean after that.,[Yosemite campsite],
17.0,SPOCK,I believe we are required to engage in a ritual known as the singalong.,[Yosemite campsite],
17.0,KIRK,"I haven't sung around a campfire since I was a boy in Iowa. Wait a minute. Bones, what are we gonna sing?",[Yosemite campsite],
17.0,McCOY,How about 'Camptown Races?',[Yosemite campsite],
17.0,KIRK,'Pack Up Your Troubles.',[Yosemite campsite],
17.0,SPOCK,"Are we leaving, Captain?",[Yosemite campsite],
17.0,McCOY,"It's a song title, Spock.",[Yosemite campsite],
17.0,SPOCK,Ah.,[Yosemite campsite],
17.0,KIRK,'Moon Over Rigel Seven?',[Yosemite campsite],
17.0,McCOY,"'Row, Row, Row Your Boat.'",[Yosemite campsite],
17.0,KIRK,"'Row, Row, Row Your Boat.' I love 'Row, Row... Do you 'Row, Row, ...Row Your Boat', Spock?",[Yosemite campsite],
17.0,SPOCK,"That song did not come up in my research, Captain.",[Yosemite campsite],
17.0,KIRK,"The lyrics are very simple. It's 'Row, row, row your boat, gently down the stream, ...merrily, merrily, merrily, merrily, life is but a dream.' The Doctor and I will start it off and then when we give you the signal you jump in. Doctor if you please.",[Yosemite campsite],
17.0,McCOY,Don't say I didn't warn you.,[Yosemite campsite],
17.0,KIRK/McCOY,"'Row, row, row your boat gently down the stream merrily, merrily, merrily, ...merrily, life...'",[Yosemite campsite],
17.0,KIRK,"Come on, Spock? Why didn't you jump in?",[Yosemite campsite],
17.0,SPOCK,I was trying to comprehend the meaning of the words.,[Yosemite campsite],
17.0,McCOY,"It's a song, you greenblooded a Vulcan. You sing it. The words aren't important. What's important is that you have a good time singing it.",[Yosemite campsite],
17.0,SPOCK,"Oh, I am sorry, Doctor. ...Were we having a good time?",[Yosemite campsite],
17.0,McCOY,God! I liked him better before he died.,[Yosemite campsite],
17.0,KIRK,"No, no, no, stop it. Let's... Let's go to bed and just let's get some sleep?",[Yosemite campsite],
17.0,SPOCK,Captain?,[Yosemite campsite],
17.0,KIRK,"Spock, we're on leave. Call me Jim.",[Yosemite campsite],
17.0,SPOCK,Jim?,[Yosemite campsite],
17.0,KIRK,"Yes, Spock?",[Yosemite campsite],
17.0,SPOCK,Life is not a dream.,[Yosemite campsite],
17.0,KIRK,"Go to sleep, Spock.",[Yosemite campsite],
17.0,SPOCK,Yes Captain.,[Yosemite campsite],
17.0,KIRK,"Good night, Bones.",[Yosemite campsite],
17.0,McCOY,"Good night, Jim.",[Yosemite campsite],
17.0,KIRK,"Good night, Spock.",[Yosemite campsite],
17.0,SPOCK,"Good night, Doctor.",[Yosemite campsite],
17.0,McCOY,"Good night, Spock.",[Yosemite campsite],
17.0,SPOCK,"Good night, Jim.",[Yosemite campsite],
18.0,VIXIS,"in Klingonese Captain Klaa, we have the target in sight. A probe of ancient origin.",[Bird-of-Prey bridge],
18.0,KLAA,in Klingonese Difficult to hit?,[Bird-of-Prey bridge],(the Pioneer 10 probe is seen drifting in space)
18.0,VIXIS,in Klingonese Most difficult.,[Bird-of-Prey bridge],
18.0,KLAA,in Klingonese Good. All weapons at my control. ...Scope!,[Bird-of-Prey bridge],
18.0,KLAA,in Klingonese Shooting space garbage is no test of a warrior's mettle. I need a target that fights back.,[Bird-of-Prey bridge],
18.0,VIXIS,"in Klingonese Captain, new data. Hostages on Nimbus Three.",[Bird-of-Prey bridge],
18.0,VIXIS,in Klingonese One of the hostages is a Klingon.,[Bird-of-Prey bridge],
18.0,KLAA,in Klingonese And the others?,[Bird-of-Prey bridge],
18.0,VIXIS,in Klingonese A Terran and a Romulan.,[Bird-of-Prey bridge],(more information is received on the viewscreen)
18.0,KLAA,in Klingonese That means the Federation will be sending a rescue ship of its own. Plot course for Nimbus Three. ...I've always wanted to engage a Federation ship.,[Bird-of-Prey bridge],
19.0,McCOY,Get that damn light out of my face!,[Yosemite campsite],
19.0,UHURA,"Mister Scott apologises for having to send the shuttlecraft The transporter beam is nonoperational. Captain, we've received important orders from Starfleet Command.",[Yosemite campsite],
19.0,KIRK,Why didn't you beep my communicator?,[Yosemite campsite],(noise and downdraught from a hovering shuttlecraft awake the campers)
19.0,UHURA,You forgot to take it with you.,[Yosemite campsite],
19.0,KIRK,"Wonder why I did that? ...Well, gentlemen, it appears shore leave's been cancelled. Pack out your trash.",[Yosemite campsite],
20.0,KIRK,'All I ask is a tall ship and a star to steer her by.',[Galileo 5],
20.0,McCOY,Melville.,[Galileo 5],
20.0,SPOCK,John Masefield.,[Galileo 5],
20.0,McCOY,Are you sure about that?,[Galileo 5],
20.0,SPOCK,"I am well versed in the classics, Doctor",[Galileo 5],
20.0,McCOY,"Then how come you don't know 'Row, Row, Row Your Boat?'",[Galileo 5],
21.0,UHURA (OC),"Ready for landing maneuver. Enterprise, you have control.",[Enterprise-A shuttlebay control room],
21.0,SCOTT,We're doing just fine.,[Enterprise-A shuttlebay control room],
22.0,SCOTT,All I can say is they don't make 'em like they used to.,[Enterprise-A shuttlebay],
22.0,KIRK,You told me you could have the ship operational in two weeks. I gave you three. What happened?,[Enterprise-A shuttlebay],
22.0,SCOTT,"I think you gave me too much time, Captain.",[Enterprise-A shuttlebay],
22.0,KIRK,"Very well, Mister Scott. Carry on.",[Enterprise-A shuttlebay],
22.0,SCOTT,"Right, sir. ...How many times do I have to tell you? The right tool for the right job.",[Enterprise-A shuttlebay],
22.0,McCOY,I don't think I've ever seen him happier.,[Enterprise-A shuttlebay],
23.0,KIRK,"Bridge, ...I hope. ...I could use a shower.",[Enterprise-A turbolift],
23.0,SPOCK,Yes.,[Enterprise-A turbolift],
24.0,KIRK,Doesn't anything work on this ship?,[Enterprise-A bridge],
24.0,McCOY,"Starfleet's got some nerve sending us out in this condition. Why, the ship's a virtual ghost town.",[Enterprise-A bridge],
24.0,UHURA,Captain! Starfleet transmission online.,[Enterprise-A bridge],(the turbolift doors fail to open properly)
24.0,KIRK,"Put it on the viewscreen screen, will you please? ...Can we have a little quiet, please? ...Can you clear that up? ...Can we have a little quiet? ...Bob?",[Enterprise-A bridge],
24.0,ADMIRAL BENNETT (on viewscreen),"Jim? Well, we're dressing informally, aren't we?",[Enterprise-A bridge],
24.0,KIRK,You caught me on my way to the shower.,[Enterprise-A bridge],
24.0,ADMIRAL BENNETT (on viewscreen)),"I apologise for cancelling shore leave but look, we have a dangerous situation out on Nimbus Three.",[Enterprise-A bridge],
24.0,KIRK,On 'The Planet of Galactic Peace?',[Enterprise-A bridge],
24.0,ADMIRAL BENNETT (on viewscreen),"The same. From what we can make out, a terrorist force has captured the only settlement and they've taken hostages. The Klingon, the Romulan and the Federation consuls. Now I know Enterprise is not exactly up to specs...",[Enterprise-A bridge],
24.0,KIRK,"With all due respect, the Enterprise is a disaster. There must be other ships in the Quadrant.",[Enterprise-A bridge],
24.0,ADMIRAL BENNETT (on viewscreen),"Other ships, yes, but no experienced commanders. Captain, ...I need Jim Kirk. Your orders are to proceed to Nimbus Three, assess the situation and avoid confrontation if possible. Above all, however, all get those hostages back safely.",[Enterprise-A bridge],
24.0,KIRK,Have the Klingons responded?,[Enterprise-A bridge],
24.0,ADMIRAL BENNETT (on viewscreen),"No, but you can bet they will.",[Enterprise-A bridge],
24.0,KIRK,"Understood. Kirk out. Plot course to Nimbus Three, Mister Sulu.",[Enterprise-A bridge],
24.0,SULU,Aye sir. Course plotted.,[Enterprise-A bridge],
24.0,KIRK,I'm afraid the ship's problems will have to be solved en route. Since we're undermanned I'm counting on each one of you to give his best. End of speech. Let's go to work.,[Enterprise-A bridge],
24.0,McCOY,"Jim! If you ask me, ...and you haven't, I think this is a terrible idea. We're bound to bump into the Klingons and they don't exactly like you.",[Enterprise-A bridge],
24.0,KIRK,The feeling's mutual. Engine room.,[Enterprise-A bridge],
24.0,SCOTT (OC),Scotty here.,[Enterprise-A bridge],
24.0,KIRK,"We'll need all the power you can muster, Mister",[Enterprise-A bridge],
25.0,SCOTT,"Don't you worry, Captain. We'll beat those Klingon devils even if I have to get out and push.",[Enterprise-A engineering],
26.0,KIRK,"I hope it won't come to that, Mister Scott. ...All possible speed, Mister Sulu.",[Enterprise-A bridge],
26.0,SULU,Aye sir.,[Enterprise-A bridge],
26.0,McCOY,"What's the matter, Jim?",[Enterprise-A bridge],
26.0,KIRK,I miss my old chair.,[Enterprise-A bridge],
27.0,VIXIS,in Klingonese The Starship Enterprise has been dispatched to Nimbus Three.,[Bird-of-Prey bridge],
27.0,KLAA,in Klingonese Enterprise? That's Kirk's ship. ...If I could defeat Kirk...,[Bird-of-Prey bridge],
27.0,VIXIS,in Klingonese ...you would be the greatest warrior in the galaxy.,[Bird-of-Prey bridge],
27.0,KLAA,in Klingonese Maximum speed! ...Success!,[Bird-of-Prey bridge],
28.0,LOGBOOK,"Good morning, Captain.",[Enterprise-A bridge],
28.0,KIRK,...Forget it.,[Enterprise-A bridge],(Kirk is using a new electronic log book)
28.0,UHURA,"Captain, we are receiving the hostage information you requested.",[Enterprise-A bridge],"KIRK (OC): Captain's log. Stardate eighty-four fifty... Captain's log, stardate eighty-four..."
28.0,KIRK,Put it on the screen.,[Enterprise-A bridge],(the log book fails for the second time. He shuts it)
28.0,STARFLEET VOICE,This is an authorised transmission from the Starfleet Command memory bank.,[Enterprise-A bridge],
28.0,KIRK,Not General Korrd!,[Enterprise-A bridge],
28.0,SPOCK,The same. He has apparently fallen out of favour with the Klingon High Command.,[Enterprise-A bridge],
28.0,KIRK,"General Korrd's military strategies were required learning when I was a cadet at the Academy. When they put me out to pasture, I hope I fare better than Korrd.",[Enterprise-A bridge],
28.0,McCOY,"Ah, this must be the hostage tape.",[Enterprise-A bridge],
28.0,CAITHLIN (on viewscreen),"A short time ago we surrendered ourselves to the forces of the Galactic Army of Light. At this moment, we are in their protective custody. Their leader assures us that we will be treated humanely as long as we cooperate with his demands. I believe his sincerity. He requests that you send a Federation starship to parlay for our release at once. Be assured we are in good health and would appreciate your immediate response.",[Enterprise-A bridge],
28.0,SYBOK (on viewscreen),"I deeply regret this desperate act but these are desperate times. I have no desire to harm these innocents but do not put me to the test. I implore you... I implore you to respond, ...immediately.",[Enterprise-A bridge],
28.0,KIRK,What is it? You look like you've just seen a ghost.,[Enterprise-A bridge],
28.0,SPOCK,"Perhaps I have, Captain.",[Enterprise-A bridge],
29.0,KIRK,"Spock, what is it? Do you know this Vulcan?",[Enterprise-A forward observation room],
29.0,SPOCK,I cannot be sure.,[Enterprise-A forward observation room],
29.0,KIRK,But he does seem familiar.,[Enterprise-A forward observation room],
29.0,SPOCK,He reminds me of someone I knew in my youth.,[Enterprise-A forward observation room],
29.0,McCOY,"Why, Spock, I didn't know you had one.",[Enterprise-A forward observation room],
29.0,SPOCK,I do not often think of the past.,[Enterprise-A forward observation room],
29.0,KIRK,Who is it he reminds you of?,[Enterprise-A forward observation room],
29.0,SPOCK,"There was a young student, ...exceptionally gifted, ...possessing ...great intelligence. It was assumed that one day he would take his place amongst the great scholars of Vulcan. But he was a revolutionary.",[Enterprise-A forward observation room],
29.0,KIRK,What do you mean?,[Enterprise-A forward observation room],
29.0,SPOCK,The knowledge and experience he sought were forbidden by Vulcan belief.,[Enterprise-A forward observation room],
29.0,KIRK,Forbidden?,[Enterprise-A forward observation room],
29.0,SPOCK,He rejected his logical upbringing. He embraced the animal passions of our ancestors.,[Enterprise-A forward observation room],
29.0,KIRK,Why?,[Enterprise-A forward observation room],
29.0,SPOCK,"He believed that the key to selfknowledge was emotion, ...not logic.",[Enterprise-A forward observation room],
29.0,McCOY,Imagine that. A passionate Vulcan.,[Enterprise-A forward observation room],
29.0,SPOCK,"When he encouraged others to follow him, he was banished from Vulcan, never to return.",[Enterprise-A forward observation room],
29.0,KIRK,Fascinating.,[Enterprise-A forward observation room],
29.0,UHURA (OC),Captain to the bridge.,[Enterprise-A forward observation room],
29.0,KIRK,On my way. ...Spock?,[Enterprise-A forward observation room],
29.0,SPOCK,"Coming, Captain.",[Enterprise-A forward observation room],
30.0,SULU,Approaching Nimbus Three.,[Enterprise-A bridge],
30.0,UHURA (OC),Hailing frequencies open.,[Enterprise-A bridge],
30.0,KIRK,"Standard orbit, Mister Sulu.",[Enterprise-A bridge],
30.0,UHURA,"Captain, we're receiving a transmission from Paradise City. They are demanding to know our intentions.",[Enterprise-A bridge],
30.0,KIRK,Respond with static. Let them think we're having difficulty. It wouldn't be far from the truth.,[Enterprise-A bridge],
30.0,UHURA,"Paradise City, can you boost your power? We are barely receiving transmission.",[Enterprise-A bridge],
30.0,KIRK,Transporter room. Status.,[Enterprise-A bridge],
31.0,SCOTT,"Scotty here, Captain. Transporter still inoperative. Even if we could lock on to the hostages, we could'na beam them up.",[Enterprise-A transporter room],
32.0,KIRK,Then we'll have to get them out the old fashioned way.,[Enterprise-A bridge],
32.0,SPOCK,Klingon vessel now entering. BirdofPrey. Estimating one point nine hours until her weapons come to bear.,[Enterprise-A bridge],
32.0,KIRK,Damn. Let's go.,[Enterprise-A bridge],
33.0,SPOCK,Their scanning equipment is primitive but effective. I recommend we land at coordinates eight five six three.,[Galileo 5],
33.0,KIRK,That puts us pretty far away from Paradise City.,[Galileo 5],
33.0,SPOCK,To land any closer would be to risk detection.,[Galileo 5],
33.0,KIRK,"Mister Sulu, ...execute.",[Galileo 5],
33.0,SULU,Aye sir.,[Galileo 5],
34.0,CHEKOV (OC),"Paradise City, this is the Starship Enterprise.",[Paradise City saloon backroom],
